{
  "$schema": "https://json-schema.org/draft/2020-12/schema",
  "$id": "https://smpcc.local/schema/target_host_u3_solver_cpu_settle_cold_a_execution_policy_v5.json",
  "title": "R8 liquid target-host U3 C1M CPU solver settle cold A execution policy v5",
  "type": "object",
  "additionalProperties": false,
  "required": [
    "schema_version",
    "document_type",
    "policy_id",
    "host_id",
    "development_only",
    "formal",
    "physical_primary_eligible",
    "execution_scope",
    "allowed_gate_commands",
    "frozen_attempt",
    "provenance",
    "trusted_artifacts",
    "trusted_tools",
    "lifecycle_harness",
    "immutable_transport",
    "input_contract",
    "isolation",
    "resources",
    "fixed_guest_command",
    "output_contract",
    "profile_lifecycle",
    "invariants",
    "status",
    "next_allowed_stage"
  ],
  "properties": {
    "schema_version": {"const": "smpcc-r8-liquid-target-u3-solver-cpu-settle-cold-a-execution-policy-v5"},
    "document_type": {"const": "SMPCC_R8_LIQUID_TARGET_U3_SOLVER_CPU_SETTLE_COLD_A_EXECUTION_POLICY_V5"},
    "policy_id": {"const": "LIQUID_ZRJ_MSI_U2404_U3_SOLVER_CPU_SETTLE_COLD_A_EXECUTION_V5"},
    "host_id": {"const": "LIQUID_ZRJ_MSI_U2404"},
    "development_only": {"const": true},
    "formal": {"const": false},
    "physical_primary_eligible": {"const": false},
    "execution_scope": {"type": "string", "minLength": 1},
    "allowed_gate_commands": {"const": ["self-check", "internal-run"]},
    "frozen_attempt": {"type": "object"},
    "provenance": {"type": "object"},
    "trusted_artifacts": {"type": "object"},
    "trusted_tools": {"type": "object"},
    "lifecycle_harness": {"type": "object"},
    "immutable_transport": {"type": "object"},
    "input_contract": {"type": "object"},
    "isolation": {"type": "object"},
    "resources": {"type": "object"},
    "fixed_guest_command": {"type": "object"},
    "output_contract": {"type": "object"},
    "profile_lifecycle": {"type": "object"},
    "invariants": {"type": "object"},
    "status": {"const": "REVIEWED_FRESH_C1M_CPU_SOLVER_SETTLE_COLD_A_V5_TWO_KNOWN_QUIET_DENY_RULES_PENDING_STATIC_VERIFICATION"},
    "next_allowed_stage": {"const": "SEPARATE_COLD_A_OUTPUT_QC_THEN_IF_PASS_FRESH_COLD_B_ADMISSION"}
  }
}
