{
  "schema_version": "smpcc-r8-liquid-target-u3-solver-cpu-settle-cold-a-execution-policy-v5",
  "document_type": "SMPCC_R8_LIQUID_TARGET_U3_SOLVER_CPU_SETTLE_COLD_A_EXECUTION_POLICY_V5",
  "policy_id": "LIQUID_ZRJ_MSI_U2404_U3_SOLVER_CPU_SETTLE_COLD_A_EXECUTION_V5",
  "host_id": "LIQUID_ZRJ_MSI_U2404",
  "development_only": true,
  "formal": false,
  "physical_primary_eligible": false,
  "execution_scope": "one_fresh_c1m_zero_motion_cpu_solver_8_05s_settle_cold_a_with_two_exact_quiet_deny_rules_after_static_review_and_explicit_admission",
  "allowed_gate_commands": [
    "self-check",
    "internal-run"
  ],
  "frozen_attempt": {
    "case_id": "u3_c1m_solver_cpu_settle_cold_a_v5_20260808T203712Z",
    "campaign_id": "u3_c1m_solver_cpu_settle_ab_campaign_20260808T203712Z",
    "campaign_role": "cold_a",
    "cold_b_identity_allocated": false,
    "supervisor_admission_token": "u3_c1m_solver_cpu_settle_ab_campaign_20260808T203712Z:u3_c1m_solver_cpu_settle_cold_a_v5_20260808T203712Z:single-cpu-solver-settle-cold-a-v5-attempt",
    "attempt_root": "/home/zrj/scout_liquid_lab/cases/u3_c1m_solver_cpu_settle_cold_a_v5_20260808T203712Z.partial",
    "output_root": "/home/zrj/scout_liquid_lab/cases/u3_c1m_solver_cpu_settle_cold_a_v5_20260808T203712Z.partial/output",
    "start_receipt": "/home/zrj/scout_liquid_lab/audits/u3_c1m_solver_cpu_settle_cold_a_v5_20260808T203712Z.start.json",
    "execution_receipt": "/home/zrj/scout_liquid_lab/audits/u3_c1m_solver_cpu_settle_cold_a_v5_20260808T203712Z.execution.json",
    "lifecycle_receipt": "/home/zrj/scout_liquid_lab/audits/u3_c1m_solver_cpu_settle_cold_a_v5_20260808T203712Z.lifecycle.json",
    "lifecycle_failure_receipt": "/home/zrj/scout_liquid_lab/audits/u3_c1m_solver_cpu_settle_cold_a_v5_20260808T203712Z.lifecycle_incomplete.json",
    "console_log": "/home/zrj/scout_liquid_lab/audits/u3_c1m_solver_cpu_settle_cold_a_v5_20260808T203712Z.console.log",
    "snapshot_root": "/run/r8-liquid-u3_c1m_solver_cpu_settle_cold_a_v5_20260808T203712Z.snapshot",
    "bootstrap_profile": "r8-liquid-u3-c1m-solver-cpu-settle-cold-a-bootstrap-v5-20260808t203712z",
    "runtime_profile": "r8-liquid-u3-c1m-solver-cpu-settle-cold-a-runtime-v5-20260808t203712z",
    "attempts_per_identity": 1,
    "same_identity_retry": "forbidden"
  },
  "provenance": {
    "gencase_seed_v3_receipt": {
      "path": "/home/zrj/scout_liquid_lab/audits/u3_c1m_gencase_seed_v3_20260808T150802Z.json",
      "sha256": "79f43b54594843e0107aa78ad01db34937fa97f0a34a16d96e74ac9cd90095ed",
      "size_bytes": 12382,
      "status": "PASS_NONEXECUTABLE_GENCASE_SEED_V3_MATERIALIZATION",
      "seed_id": "u3_c1m_gencase_seed_v3_20260808T150802Z"
    },
    "cpu_build_receipt": {
      "path": "/home/zrj/scout_liquid_lab/audits/u3_source_cpu_build_20260807T023724Z_cpu_build.json",
      "sha256": "d407233107d4bc9eeea81b0c5a95cbfc98ad6529f1cb7494b68ae5ecc4b1d604",
      "status": "PASS_U3_CPU_BUILD_STATIC_ELF_AUDIT",
      "compiled_artifact_executed": false
    },
    "gencase_execution_receipt": {
      "path": "/home/zrj/scout_liquid_lab/audits/u3_c1m_gencase_v8_20260808T153753Z.execution.json",
      "sha256": "113ce7d570a15abe415cdd3e703604870c0980eaad37f845fe1b71a2242aac32",
      "status": "PASS_U3_C1M_GENCASE_V8_CASE_EXPORTED_CLEANUP_PENDING"
    },
    "gencase_lifecycle_receipt": {
      "path": "/home/zrj/scout_liquid_lab/audits/u3_c1m_gencase_v8_20260808T153753Z.lifecycle.json",
      "sha256": "d595dc8665175f0b6e2dca0e88db41c9bcba4c9dbb63cec97c827a20459a7eea",
      "status": "PASS_U3_C1M_GENCASE_V8_LIFECYCLE_CLEANUP_AND_CASE_EXPORT"
    },
    "consumed_v1_attempt": {
      "case_id": "u3_c1_solver_cpu_smoke_v1_20260808T124816Z",
      "identity_consumed": true,
      "retry_forbidden": true,
      "output_exported": false,
      "failure_reason": "solver and gate returned zero with an 8480536-byte candidate frame, but one unexpected logged AppArmor denial for bwrap reading /etc/ld.so.cache correctly prevented export",
      "observed_gate_returncode": 0,
      "observed_solver_returncode": 0,
      "candidate_frame_size_bytes": 8480536,
      "receipts": {
        "start": {
          "path": "/home/zrj/scout_liquid_lab/audits/u3_c1_solver_cpu_smoke_v1_20260808T124816Z.start.json",
          "sha256": "779feb5bdccdb2c833a4c04dd06ebf6241434b3343a3506753a9b82544758238",
          "size_bytes": 10274,
          "status": "ONE_SHOT_STARTED_NO_RETRY_SAME_IDENTITY"
        },
        "execution": {
          "path": "/home/zrj/scout_liquid_lab/audits/u3_c1_solver_cpu_smoke_v1_20260808T124816Z.execution.json",
          "sha256": "6c8a2600bcb40c1039976061ec296509c4a2d6d6e89e941de9b7bfb4edf48494",
          "size_bytes": 7614,
          "status": "ATTEMPT_ABORTED_NO_RETRY_SAME_IDENTITY"
        },
        "lifecycle_incomplete": {
          "path": "/home/zrj/scout_liquid_lab/audits/u3_c1_solver_cpu_smoke_v1_20260808T124816Z.lifecycle_incomplete.json",
          "sha256": "412d7e8a5c1adfc340707f6af608ab29c23f2a9446dfa6c32453a12b48caa090",
          "size_bytes": 5037,
          "status": "LIFECYCLE_OR_EXECUTION_INCOMPLETE_NO_RETRY_SAME_IDENTITY"
        }
      }
    },
    "completed_c1_v2_attempt": {
      "case_id": "u3_c1_solver_cpu_smoke_v2_20260808T134452Z",
      "identity_consumed": true,
      "retry_forbidden": true,
      "output_exported": true,
      "receipts": {
        "start": {
          "path": "/home/zrj/scout_liquid_lab/audits/u3_c1_solver_cpu_smoke_v2_20260808T134452Z.start.json",
          "sha256": "6050a28d4f1093761d94a502df8635bb5964eaa161aa3f69c20e63c056799a63",
          "size_bytes": 10966,
          "status": "V2_ONE_SHOT_STARTED_NO_RETRY_SAME_IDENTITY"
        },
        "execution": {
          "path": "/home/zrj/scout_liquid_lab/audits/u3_c1_solver_cpu_smoke_v2_20260808T134452Z.execution.json",
          "sha256": "bfa560359e045158a25da9c75850f4a3c40f0fb22012e410f2abab46f36c88d0",
          "size_bytes": 42463,
          "status": "PASS_U3_C1_CPU_SOLVER_V2_SMOKE_EXPORTED_CLOSED_ZERO_UNEXPECTED_LOGGED_DENIALS_TWO_KNOWN_QUIET_DENY_RULES_CLEANUP_PENDING"
        },
        "lifecycle": {
          "path": "/home/zrj/scout_liquid_lab/audits/u3_c1_solver_cpu_smoke_v2_20260808T134452Z.lifecycle.json",
          "sha256": "e01f81c864fa444b312dbe68b6d5490d45f53d8f99d180e3c71600fbcf6bad39",
          "size_bytes": 6337,
          "status": "PASS_U3_C1_CPU_SOLVER_V2_LIFECYCLE_CLEANUP_SMOKE_EXPORT_CLOSED_ZERO_UNEXPECTED_LOGGED_DENIALS_TWO_KNOWN_QUIET_DENY_RULES"
        }
      }
    },
    "solver_needed": [
      "libgomp.so.1",
      "libstdc++.so.6",
      "libm.so.6",
      "libgcc_s.so.1",
      "libc.so.6"
    ],
    "solver_rpath": false,
    "solver_runpath": false,
    "completed_c1m_v3_smoke": {
      "case_id": "u3_c1m_solver_cpu_smoke_v3_20260808T160108Z",
      "identity_consumed": true,
      "retry_forbidden": true,
      "output_exported": true,
      "policy": {
        "path": "/home/zrj/scout_ws/src/scout_apps/simulation/scout_dualsphysics_liquid/config/target_hosts/liquid_zrj_msi_u2404_u3_solver_cpu_execution_policy_v3.json",
        "sha256": "afef0482dabdde27c3552aa766a426a5c842c0c8d33ebb9f2c947c898d1fa6a0",
        "size_bytes": 19495,
        "status": "REVIEWED_FRESH_SINGLE_C1M_CPU_SOLVER_SMOKE_V3_TWO_KNOWN_QUIET_DENY_RULES_PENDING_STATIC_VERIFICATION"
      },
      "receipts": {
        "start": {
          "path": "/home/zrj/scout_liquid_lab/audits/u3_c1m_solver_cpu_smoke_v3_20260808T160108Z.start.json",
          "sha256": "8a93606fa656bbd301ec6214809ea4f315a5e9c53863fcbe12af57d57d6e95cc",
          "size_bytes": 11050,
          "status": "V3_ONE_SHOT_STARTED_NO_RETRY_SAME_IDENTITY"
        },
        "execution": {
          "path": "/home/zrj/scout_liquid_lab/audits/u3_c1m_solver_cpu_smoke_v3_20260808T160108Z.execution.json",
          "sha256": "8ff89dd45a6548d684e75b18ef4443f63728c5604a850e81da890df7c74d916f",
          "size_bytes": 43646,
          "status": "PASS_U3_C1M_CPU_SOLVER_V3_SMOKE_EXPORTED_CLOSED_ZERO_UNEXPECTED_LOGGED_DENIALS_TWO_KNOWN_QUIET_DENY_RULES_CLEANUP_PENDING"
        },
        "lifecycle": {
          "path": "/home/zrj/scout_liquid_lab/audits/u3_c1m_solver_cpu_smoke_v3_20260808T160108Z.lifecycle.json",
          "sha256": "8d4541cfbba652dc0849dfaceb6ef1be2a876a0ee36136247365decef5f2ffe9",
          "size_bytes": 6409,
          "status": "PASS_U3_C1M_CPU_SOLVER_V3_LIFECYCLE_CLEANUP_SMOKE_EXPORT_CLOSED_ZERO_UNEXPECTED_LOGGED_DENIALS_TWO_KNOWN_QUIET_DENY_RULES"
        }
      },
      "output_qc": {
        "path": "/home/zrj/scout_liquid_lab/visualizations/u3_c1m_solver_cpu_smoke_v3_20260808T160108Z_v2/reports/solver_output_qc_v3.json",
        "sha256": "e008fe0201802899a77e2f50bf273ef18c7cef92ca6d9a4a6d33c17adc47ee3e",
        "size_bytes": 114699,
        "status": "C1M_ZERO_MOTION_SMOKE_PASS",
        "structural_pass": true,
        "duration_eligible_for_settle_qc": false,
        "tail_pass": false,
        "numeric_settle_qc_pass": false,
        "settled_state_freeze_eligible": false
      },
      "accepted_visualization": {
        "root": "/home/zrj/scout_liquid_lab/visualizations/u3_c1m_solver_cpu_smoke_v3_20260808T160108Z_v2",
        "artifact_manifest": {
          "path": "/home/zrj/scout_liquid_lab/visualizations/u3_c1m_solver_cpu_smoke_v3_20260808T160108Z_v2/artifact_manifest.json",
          "sha256": "d096e6663352b464646b81cea138797c98d86c8b6d351b2595a0b157cb003636",
          "size_bytes": 6720,
          "status": "PASS_U3_C1M_SOLVER_SMOKE_VISUALIZED_NOT_SETTLED"
        },
        "accepted_revision": "v2",
        "settled_state_freeze_eligible": false
      },
      "source_use": "provenance_only_no_v3_solver_output_reuse"
    },
    "consumed_cold_a_v4_attempt": {
      "case_id": "u3_c1m_solver_cpu_settle_cold_a_v4_20260808T174116Z",
      "identity_consumed": true,
      "retry_forbidden": true,
      "output_exported": false,
      "policy": {